S/N,Code,Description,Table,Classification,Cleaned_Description,PCA_X,PCA_Y
67,SK703L,"SYMPATHETIC NERVES, BLOCK, ANAESTHETIC (UNILATERAL/BILATERAL)",1B,Existing,sympathetic nerve block anaesthetic unilateralbilateral,-0.10382096052826802,-0.0826007821652044
69,SI705U,"UTERUS, ELONGATED CERVIX, CYSTOCOELE, RECTOCOELE, AMPUTATION OF CERVIX + ANTERIOR REPAIR + POSTERIOR REPAIR",4B,Existing,uterus elongated cervix cystocoele rectocoele amputation cervix anterior repair posterior repair,-0.09780326700455155,-0.08271368636248032
149,SF810E,"ESOPHAGUS, VARICES, ESOPHAGEAL/TRANSECTION WITH SPLENECTOMY",6B,Existing,esophagus varix esophagealtransection splenectomy,-0.06805691829155652,-0.036210926982972846
164,SD706V,"VEIN, PERIPHERAL VEINS (UPPER/LOWER LIMBS/DIALYSIS ARTERIOVENUS FISTULA/ARTERIOVENUS GRAFT FISTULA), VARIOUS LESIONS, DIAGNOSTIC VENOGRAPHY",2A,Existing,vein peripheral vein upperlower limbsdialysis arteriovenus fistulaarteriovenus graft fistula various lesion diagnostic venography,0.1310191694649483,-0.04595495958642257
64,SK700L,"SYMPATHETIC NERVES, BLOCK, CATHETER (UNILATERAL/BILATERAL)",2B,Existing,sympathetic nerve block catheter unilateralbilateral,-0.09731150734222706,-0.0849780838000715
142,SI712V,"VAGINA/RECTUM, RECTO VAGINAL FISTULA, COMPLEX RECTAL/TRANSPERINEAL APPROACH WITHOUT COLOSTOMY",4C,Existing,vaginarectum recto vaginal fistula complex rectaltransperineal approach without colostomy,-0.08606240843380697,-0.06452048993925777
204,SF809L,"LIVER, TRAUMA/TUMOR, EXTENDED LOBECTOMY (5 SEGMENTS/MORE)",7C,Existing,liver traumatumor extended lobectomy 5 segmentsmore,-0.06143238604184612,-0.041184480498042866
392,SB850M,"MUSCLE (UPPER LIMB), VARIOUS LESIONS, MARGINAL EXCISION",2C,Existing,muscle upper limb various lesion marginal excision,0.16847910511148687,0.19673074708291355
274,SF804P,"PALATE, CLEFT, UVULOPHARYNGOPLASTY",5C,Existing,palate cleft uvulopharyngoplasty,-0.07899391277288831,-0.04057672773007697
74,SK706N,"COELIAC PLEXUS, BLOCK, NEUROLYTIC",2B,Existing,coeliac plexus block neurolytic,-0.0941159847862548,-0.0672810798946091
40,SF817A,"ABDOMINAL WALL, INGUINAL HERNIA (INFANTS & CHILDREN), HERNIOTOMY (BILATERAL)",4A,Existing,abdominal wall inguinal hernia infant child herniotomy bilateral,-0.08348605634080106,-0.056932958675018214
99,SK733N,"PERIPHERAL NERVE, BLOCK, ANAESTHETIC (UP TO 2 NERVES)",1A,Existing,peripheral nerve block anaesthetic 2 nerve,-0.1064611243120255,-0.09091599836173285
165,SF802G,"GALLBLADDER, VARIOUS LESIONS, CHOLECYSTECTOMY AND CHOLEDOCHO- JEJUNOSTOMY/DUODENOSTOMY/GASTROSTOMY",5C,Existing,gallbladder various lesion cholecystectomy choledocho jejunostomyduodenostomygastrostomy,0.28920413899753766,-0.026324592191840517
181,SI830V,"VULVA, LACERATION, DEBRIDEMENT/SUTURE <5CM (SIMPLE)",MSP,Existing,vulva laceration debridementsuture 5cm simple,-0.09464648056242568,-0.029263043573290324
123,SL804L,"LACRIMAL GLAND/DUCT, VARIOUS LESIONS, DACROCYSTORHINOSTOMY (ENDOSCOPIC/NON- ENDOSCOPIC) OR CONJUNCTIVAL-DCR (LESTER JONES TUBE)",5C,Existing,lacrimal glandduct various lesion dacrocystorhinostomy endoscopicnon endoscopic conjunctivaldcr lester jones tube,0.22116616105471953,-0.03901928015011191
68,SL812E,"EYE, SQUINT, OPERATION (ONE/BOTH EYES - ADJUSTABLE SUTURES)",4A,Existing,eye squint operation oneboth eye adjustable suture,-0.07838409093450614,-0.06519445875675586
88,SK720N,"NERVE (UPPER LIMB), DEFECT, GRAFTING/INTERFASCICULAR REPAIR/NEUROVASCULAR TRANSFER",6B,Existing,nerve upper limb defect graftinginterfascicular repairneurovascular transfer,-0.12941912475667045,0.004114647800001393
61,SC810T,"THORAX, VARIOUS LESIONS, THORACOPLASTY (IN STAGES) - EACH STAGE",4A,Existing,thorax various lesion thoracoplasty stage stage,0.16483576519258739,-0.026568179045372668
192,SD806V,"VEIN, VARICOSITY, HIGH LIGATION AND COMPLETE STRIPPING/EXCISION OF SHORT SAPHENOUS VEIN",3B,Existing,vein varicosity high ligation complete strippingexcision short saphenous vein,-0.06618445076104226,-0.07409074735978922
176,SI825V,"VULVA, HEMATOMA, EVACUATION > 5CM (COMPLICATED/MORE THAN 1)",2A,Existing,vulva hematoma evacuation 5cm complicatedmore 1,-0.08395053034673253,-0.013727523349400639
44,SA832B,"IPSILATERAL MASTOPEXY/REDUCTION FOLLOWING BREAST, TUMOUR (MALIGNANT) WIDE EXCISION/LUMPECTOMY/SEGMENTAL OR PARTIAL MASTECTOMY, WITH OR WITHOUT SENTINEL NODE BIOPSY AND/OR AXILLARY CLEARANCE",4A,Existing,ipsilateral mastopexyreduction following breast tumour malignant wide excisionlumpectomysegmental partial mastectomy without sentinel node biopsy andor axillary clearance,-0.048270294712074606,0.07949762860061545
73,SI710U,"UTERUS, FIBROIDS, UTERINE ARTERY EMBOLIZATION",3C,Existing,uterus fibroid uterine artery embolization,-0.07277099683901331,-0.08172483921740543
75,SB702D,"DIGIT(S), SOFT TISSUE DEFECT, LARGE COMPLEX PEDICLED FLAPS",5C,Existing,digit soft tissue defect large complex pedicled flap,-0.12205366719761115,0.13475575297731404
69,SG728K,"KIDNEY TRANSPLANT, RECIPIENT, DUAL KIDNEY TRANSPLANT (MARGINAL DONOR)",7A,Existing,kidney transplant recipient dual kidney transplant marginal donor,-0.05976020983953921,-0.05009165676397868
39,SD738A,"AORTA, THORACIC AORTIC ANEURYSM, THORACIC ENDOVASCULAR ANEURYSM REPAIR (TEVAR)",6C,Existing,aorta thoracic aortic aneurysm thoracic endovascular aneurysm repair tevar,-0.09462760036782374,-0.04308868691564619
102,SA806S,"SKIN AND SUBCUTANEOUS TISSUE, BURNS, ESCHAROTOMY (EXTENSIVE)",2A,Existing,skin subcutaneous tissue burn escharotomy extensive,-0.12891096731137022,0.3606283634293241
285,SF815P,"PAROTID, TUMOR, TOTAL PAROTIDECTOMY WITH PARAPHARYNGEAL SPACE RESECTION AND FLAP RECONSTRUCTION",7B,Existing,parotid tumor total parotidectomy parapharyngeal space resection flap reconstruction,-0.08693353673521417,0.03593268580676408
108,SA812S,"SKIN AND SUBCUTANEOUS TISSUE, DEFECT (DEEP), DERMOFAT/FASCIA GRAFT (INCLUDING TRANSPLANT/MUSCLE FLAP)",3A,Existing,skin subcutaneous tissue defect deep dermofatfascia graft including transplantmuscle flap,-0.13812939554465775,0.32369250375841724
138,SM720S,"SINUSES-NASAL, VARIOUS LESIONS, LAVAGE THROUGH AN ORO-ANTRAL PERFORATION",MSP,Existing,sinusesnasal various lesion lavage oroantral perforation,0.8806186280415719,0.004269402029345347
115,SK800N,"NERVE, VARIOUS LESIONS, BIOPSY",1B,Existing,nerve various lesion biopsy,0.4304709636454753,0.10918384536227224
125,SM707S,"SINUSES, NASAL, HEMATOMA/ABSCESS, ANTRAL DRAINAGE",2B,Existing,sinus nasal hematomaabscess antral drainage,-0.062066690038728695,-0.03409574181427948
133,SF805D,"DUODENUM, ULCER, VAGOTOMY - ALL TYPES",5C,Existing,duodenum ulcer vagotomy type,-0.06965163179762442,-0.038640909895206174
37,SL706E,"EYE, GLAUCOMA, CYCLODESTRUCTIVE PROCEDURES",3B,Existing,eye glaucoma cyclodestructive procedure,-0.07830805952234991,-0.08105139050018319
72,SK701N,"NERVE ROOT, BLOCK (INJECTION OF ANAESTHETIC, THERAPEUTIC SUBSTANCE) - CERVICAL, 1 LEVEL",2A,Existing,nerve root block injection anaesthetic therapeutic substance cervical 1 level,-0.09699461279738063,-0.09557365484668254
513,SB827T,"TIBIA, FRACTURE(S), OPEN REDUCTION AND INTERNAL FIXATION WITH INTRAMEDULLARY ROD",4B,Existing,tibia fracture open reduction internal fixation intramedullary rod,-0.1499781839512699,-0.1987808740427593
73,SA709S,"SKIN, SURGICAL TREATMENT FOR VITILIGO (INVOLVING NON-CULTURED CELLULAR GRAFTING) (>40 SQ CM)",4B,Existing,skin surgical treatment vitiligo involving noncultured cellular grafting 40 sq cm,-0.09212975769198117,0.08052710152298027
13,SL704C,"CORNEA, RIBOFLAVIN-UVA INDUCED COLLAGEN CROSSLINKING TREATMENT FOR CORNEAL ECTASIA (CXL-CROSSLINKING LASER/POST LASIK KERATECTOMY/KERATITIS)",3B,Existing,cornea riboflavinuva induced collagen crosslinking treatment corneal ectasia cxlcrosslinking laserpost lasik keratectomykeratitis,-0.07438941788794708,-0.03606218503434545
61,SM708L,"LARYNX, TUMOR, LARYNGECTOMY (TOTAL)",5C,Existing,larynx tumor laryngectomy total,-0.07752968585837816,0.033982386965835096
282,SB832J,"JOINTS (UPPER LIMB, EXCEPT SHOULDER), SEPTIC ARTHRITIS, SIMPLE DRAINAGE",2B,Existing,joint upper limb except shoulder septic arthritis simple drainage,-0.09283578939395705,-0.04967552146053192
34,SG813B,"BLADDER, VARIOUS LESIONS, OPEN PARTIAL EXCISION",3B,Existing,bladder various lesion open partial excision,0.23517327833682197,0.16067139045956264
224,SF713M,"MOUTH, SUBLINGUAL GLAND, TUMOR, EXCISION BIOPSY",2C,Existing,mouth sublingual gland tumor excision biopsy,-0.0648404769083935,0.4010368905552048
132,SL814L,"LENS, VARIOUS LESIONS, SECONDARY INTRA-OCULAR LENS IMPLANTATION WITHOUT VITRECTOMY15",4A,Descriptor change,lens various lesion secondary intraocular lens implantation without vitrectomy15,0.12800185171754555,-0.05920177471688374
191,SF709L,"LIVER, VARIOUS LESIONS, MIS ULTRASOUND AND LOCAL ABLATION INCLUDING RADIO-FREQUENCY ABLATION",4B,Existing,liver various lesion mi ultrasound local ablation including radiofrequency ablation,0.10657857673335693,-0.03473127092811573
206,SB817H,"HAND, SOFT TISSUE TUMOR, EXCISION <1.5CM",2A,Existing,hand soft tissue tumor excision 15cm,-0.15894064492393667,0.44198063719020536
2,SC700B,"LUNG, BRONCHOSCOPY, INSERTION OF PROSTHESIS6",3B,Descriptor change,lung bronchoscopy insertion prosthesis6,-0.05096913449960628,-0.04254789612295135
127,SF702D,"DUODENUM, TUMOUR, PANCREAS PRESERVING DUODENECTOMY WITH RECONSTRUCTION OF AMPULLA",7C,Existing,duodenum tumour pancreas preserving duodenectomy reconstruction ampulla,-0.060352379768568706,-0.038908278814791676
353,SF814T,"TOOTH, DISLOCATION, REIMPLANTATION AND TRANSPLANTATION",3A,Existing,tooth dislocation reimplantation transplantation,-0.075976919793876,-0.04262335062744047
73,SM701M,"MOUTH, CAUTERY OF SOFT PALATE /TONGUE BASE",2B,Existing,mouth cautery soft palate tongue base,-0.08561081502752954,0.03198964101872625
1,SH700G,"GENITAL TRACT, VARIOUS LESIONS, HYSTEROSALPINGOGRAPHY",MSP,Existing,genital tract various lesion hysterosalpingography,0.8806186280415719,0.004269402029345347
544,SB705W,"WRIST, DISTAL RADIUS FRACTURE, OPEN REDUCTION AND INTERNAL FIXATION (ORIF) (SIMPLE OPEN REDUCTION AND PINNING)",3C,Existing,wrist distal radius fracture open reduction internal fixation orif simple open reduction pinning,-0.14483193683275805,-0.2120667444276844
51,SC800T,"THORAX, EMPYEMA, RESECTION OF RIB AND OPEN DRAINAGE",2C,Existing,thorax empyema resection rib open drainage,-0.08181067743541777,-0.08798244935720202
146,SL803O,"ORBIT, VARIOUS LESIONS, ANTERIOR ORBITOTOMY",3B,Existing,orbit various lesion anterior orbitotomy,0.3322285579117197,-0.03386663480751502
111,SI824U,"UTERUS, MALIGNANT CONDITION, ANTERIOR PELVIC EXENTERATION",6B,Existing,uterus malignant condition anterior pelvic exenteration,-0.10108502466291253,-0.03321844954984629
118,SM707P,"PHARYNX, TONGUE BASE, FOR OSA, EXCISION OF LINGUAL TONSILS",3B,Existing,pharynx tongue base osa excision lingual tonsil,-0.07905018180887981,0.161493798100492
149,SA854S,"SKIN AND SUBCUTANEOUS TISSUE, WOUND (LARGE>3CM), SECONDARY SUTURE",1B,Existing,skin subcutaneous tissue wound large3cm secondary suture,-0.11884859807863635,0.2618672018011657
26,SM812E,"EAR, FOREIGN BODY,  REMOVAL",MSP,Existing,ear foreign body removal,-0.10020267619918442,-0.02253816716075529
192,SF710L,"LIVER, VARIOUS LESIONS, TRANSJUGULAR LIVER BIOPSY",3B,Existing,liver various lesion transjugular liver biopsy,0.2408185965720643,0.06055636053989131
493,SB807T,"TENDON SHEATH (UPPER LIMB), TENOSYNOVITIS (MULTIPLE), DRAINAGE",3B,Existing,tendon sheath upper limb tenosynovitis multiple drainage,-0.1270371948144404,-0.013006894797494622
63,SC812T,"THORAX, VARIOUS LESIONS, THORACOTOMY FOR PLEURECTOMY/PLEURODESIS/ ENUCLEATION  HYDATID CYSTS",3C,Existing,thorax various lesion thoracotomy pleurectomypleurodesis enucleation hydatid cyst,0.1922259248185006,-0.022125624857865657
119,SG821U,"URETHRA, STRICTURE, URETHROTOMY",2C,Existing,urethra stricture urethrotomy,-0.05868162472003503,-0.04012539564641182
196,SF801L,"LIP, VARIOUS LESIONS, FULL THICKNESS WEDGE EXCISION WITH REPAIR",2C,Existing,lip various lesion full thickness wedge excision repair,0.14101247960241214,0.13557274743248102
135,SM717S,"SINUSES FRONTAL, VARIOUS LESIONS, CATHETERISATION",1A,Existing,sinus frontal various lesion catheterisation,0.28974882899158316,-0.01180687360422032
502,SB816T,"TENDON-FLEXOR (UPPER LIMB), ADHESION, TENOLYSIS (SINGLE)",4A,Existing,tendonflexor upper limb adhesion tenolysis single,-0.11435135745986812,-0.010143464489410581
56,SL726E,"EYE, SQUINT, OPERATION (ONE/BOTH EYES - 2 MUSCLES)",3B,Existing,eye squint operation oneboth eye 2 muscle,-0.08079945460772063,-0.06439600656057559
95,SD711H,"HEART, EXTERNAL CARDIAC PACING",MSP,Existing,heart external cardiac pacing,-0.08646000268382593,-0.09994594912764612
79,SD701B,"BLOOD VESSELS (LARGE), DISRUPTION/OBSTRUCTION, REPAIR WITH AUTOGENOUS VEIN GRAFTING",5C,Existing,blood vessel large disruptionobstruction repair autogenous vein grafting,-0.08875571027596757,-0.052519739986978176
2,SK701A,"ARTERY, EXTRACRANIAL, VARIOUS LESIONS, BALLOON TEST OCCLUSION",3B,Existing,artery extracranial various lesion balloon test occlusion,0.25722803597842686,-0.04712725318036339
234,SF806M,"MOUTH, CLEFT LIP, SECONDARY CORRECTION",4A,Existing,mouth cleft lip secondary correction,-0.08256895924348405,-0.023538482590573225
21,SI812C,"CERVIX, VARIOUS LESIONS, CRYOSURGERY",MSP,Existing,cervix various lesion cryosurgery,0.4395054359348247,-0.008743267971577614
10,SF711A,"ANAL INCONTINENCE, ARTIFICIAL BOWEL SPHINCTER INSERTION",5A,Existing,anal incontinence artificial bowel sphincter insertion,-0.06288944397811423,-0.05232388595721088
168,SA873S,"SKIN, BURNS SCAR/TATTOO (1% TO 2%), LASER EXCISION",2B,"Descriptor
change",skin burn scartattoo 1 2 laser excision,-0.1078594904420507,0.42792069480731365
531,SB803U,"UPPER LIMB, ISCHEMIA, FASCIOTOMY",2B,Existing,upper limb ischemia fasciotomy,-0.13076270250049638,0.02043289158949934
317,SF801S,"SACRUM & COCCYX, TUMOR, EXCISION WITH BIOPSY",6B,Existing,sacrum coccyx tumor excision biopsy,-0.0675604321779876,0.5668497912732386
27,SA813B,"BREAST, LUMPS (MULTIPLE/BILATERAL), EXCISION BIOPSY",3A,Existing,breast lump multiplebilateral excision biopsy,-0.027275404627342847,0.4322722857314467
110,SF707C,"COLON, COLONOSCOPY (SCREENING), FIBREOPTIC WITH REMOVAL OF POLYPS (MULTIPLE MORE THAN 1CM)",3B,Existing,colon colonoscopy screening fibreoptic removal polyp multiple 1cm,-0.08571926376396012,-0.0400567464129268
48,SL717E,"EYELID, PTOSIS, CONJUNCTIVAL MULLERECTOMY (UNILATERAL)",3B,Existing,eyelid ptosis conjunctival mullerectomy unilateral,-0.07517799711473187,-0.038869697382259816
171,SD713V,"VEIN, VARICOSE VEINS, IMAGING GUIDED ENDOVENOUS LASER TREATMENT, 1 LEG",3B,Existing,vein varicose vein imaging guided endovenous laser treatment 1 leg,-0.04878222126573245,-0.06961434505409601
8,SE707L,"LYMPH NODE (PELVIC) DISSECTION, UNILATERAL/BILATERAL",5A,Descriptor change,lymph node pelvic dissection unilateralbilateral,-0.05119648646779666,-0.00035830516496270176
52,SI806O,"OVARY, TUMOR/CYST, OOPHORECTOMY/SALPINGO- OOPHORECTOMY (COMPLICATED)",4A,Existing,ovary tumorcyst oophorectomysalpingo oophorectomy complicated,-0.07111672659809394,-0.03468325288691321
143,SL800O,"ORBIT, CONTRACTURE, RECONSTRUCTION INCLUDING MUCOUS MEMBRANE GRAFTING AND STENT MOULD",4A,Existing,orbit contracture reconstruction including mucous membrane grafting stent mould,-0.071483285837278,-0.029666982725258226
37,SI807F,"FALLOPIAN TUBE, PERITUBAL ADHESIONS, SALPINGOLYSIS (MACROSURGERY)",4A,Existing,fallopian tube peritubal adhesion salpingolysis macrosurgery,-0.08720075884964834,-0.05600182020675606
42,SA829B,"BREAST, VARIOUS LESIONS, TRUCUT BIOPSY",1A,Existing,breast various lesion trucut biopsy,0.44334395825868905,0.15388571356305675
151,SK727S,"SPINAL CORD, TUMOURS, LAMINECTOMY AND EXCISION (INTRADURAL EXTRAMEDULLARY)",6C,Existing,spinal cord tumour laminectomy excision intradural extramedullary,-0.08987466180455392,0.18017300541314024
72,SG800K,"KIDNEY AND URETER, VARIOUS LESIONS, NEPHROURETERECTOMY OPEN",5C,Existing,kidney ureter various lesion nephroureterectomy open,0.30775491164980356,-0.08826926722776457
139,SF800E,"ESOPHAGUS, ACHALASIA, CARDIOMYOTOMY",4A,Descriptor change,esophagus achalasia cardiomyotomy,-0.07766954803848586,-0.03299376582228789
146,SK721S,"SKULL, BURR HOLE, INSERTION OF INTRACRANIAL PRESSURE (ICP) MONITOR",3B,Existing,skull burr hole insertion intracranial pressure icp monitor,-0.07229068212201353,-0.043675920970993015
410,SB700R,"RADIUS AND ULNA, FRACTURE/DISLOCATION, NON UNION/DELAYED UNION BONE GRAFTING AND RE- FIXATION",5A,Existing,radius ulna fracturedislocation non uniondelayed union bone grafting fixation,-0.1026554629913495,-0.05933740953297072
101,SK736N,"PERIPHERAL NERVE, BLOCK, NEUROLYTIC (UP TO 2 NERVES)",1B,Existing,peripheral nerve block neurolytic 2 nerve,-0.1044640838481432,-0.08678408983158196
110,SK746N,"NERVE-FACIAL PARALYSIS, FREE FASCIA AND/OR NERVE GRAFT (MICROSURGICAL – STAGE 1)",3B,Existing,nervefacial paralysis free fascia andor nerve graft microsurgical stage 1,-0.08203431995730366,-0.02882049071329532
118,SF800C,"COLON, COLOSTOMY, CLOSURE WITHOUT RESECTION OF BOWEL",4A,Existing,colon colostomy closure without resection bowel,-0.05462792299505351,-0.06296141168933705
318,SF803S,"STOMACH, MORBID OBESITY, BYPASS ONLY",4A,Existing,stomach morbid obesity bypass,-0.07560982860042745,-0.03418483667387986
294,SB709K,"KNEE, LIGAMENTS/MENISCUS/CARTILAGE/BONE COMBINED, AUTOLOGOUS CHONDROCYTE IMPLANTATION WITH OSTEOTOMY",6A,Existing,knee ligamentsmeniscuscartilagebone combined autologous chondrocyte implantation osteotomy,-0.07330607812435334,-0.0657953273264653
37,SB808B,"BONE AND JOINTS (LOWER LIMB), PLATES AND SCREWS/NAILS, REMOVAL",2B,Existing,bone joint lower limb plate screwsnails removal,-0.0972210622534433,-0.027147604693851326
352,SB810M,"MANDIBLE OR MAXILLA, ODONTOGENIC CYST, MARSUPIALIZATION",2B,Existing,mandible maxilla odontogenic cyst marsupialization,-0.06499116534967686,-0.04412703156441026
321,SB808L,"LOWER LIMB, TRAUMATIC AMPUTATION, MAJOR REPLANTATION",7C,Existing,lower limb traumatic amputation major replantation,-0.09270754248957074,0.014165230958347999
32,SG811B,"BLADDER, VARIOUS LESION, ASPIRATION",MSP,Existing,bladder various lesion aspiration,0.317763780347557,-0.018226288354043572
521,SB835T,"WEDGE RESECTION OF TOE NAIL (MULTIPLE TOES), MEDIAL AND/OR LATERAL, SIMPLE OR COMPLEX",2B,Existing,wedge resection toe nail multiple toe medial andor lateral simple complex,-0.07348252176642928,-0.045577359048619266
57,SI811O,"OVARY, TUMOUR/CYST, CYSTECTOMY, SIMPLE UNILATERAL",3B,New,ovary tumourcyst cystectomy simple unilateral,-0.06986314314000107,-0.053587867883331225
53,SL722E,"EYELIDS, BOTOX INJECTIONS FOR BLEPHAROSPASM & HEMIFACIAL SPASM",1C,Existing,eyelid botox injection blepharospasm hemifacial spasm,-0.07476655198472425,-0.043325625418675
59,SA700R,"RADIOTHERAPY, ENDOLUMINAL BRACHYTHERAPY: OESOPHAGUS, NASOPHARYNGEAL CARCINOMA (NPC), HEPATOBILIARY, CARDIAC, LUNG, OTHERS",2B,Existing,radiotherapy endoluminal brachytherapy oesophagus nasopharyngeal carcinoma npc hepatobiliary cardiac lung others,-0.0709397644240786,-0.04130222532008675
432,SB725S,"SPINE, REMOVAL OR REVISION OF PORT E.G. PORT-A- CATH",MSP,Existing,spine removal revision port eg porta cath,-0.08143486424519843,-0.0711854893176805
86,SK718N,"NERVE DEFECT, PERIPHERAL GRAFT (MICROSURGERY)",5C,Existing,nerve defect peripheral graft microsurgery,-0.0986461009894042,-0.007314203063141898
393,SB851M,"MUSCLE (UPPER LIMB), VARIOUS LESIONS, WIDE EXCISION",3C,Existing,muscle upper limb various lesion wide excision,0.1758680305695184,0.2327036537151789
21,SL802C,"CONJUNCTIVA, PINGUECULA, REMOVAL",1B,Existing,conjunctiva pinguecula removal,-0.09150149197698856,-0.03187925578292244
113,SD731H,"HEART, VALVE (REPAIR / REPLACEMENT), 1 VALVE",6C,Existing,heart valve repair replacement 1 valve,-0.0875767170477803,-0.09110974626977085
161,SL705R,"RETINA, PAN RETINAL PHOTOCOAGULATION",3B,Existing,retina pan retinal photocoagulation,-0.07837986208213009,-0.04080775214884572
78,SD700B,"BLOOD VESSELS, DEFECT, MAJOR GRAFTS (MULTIPLE)",6B,Existing,blood vessel defect major graft multiple,-0.09370181298435902,0.008885596255551298
94,SI800U,"URETHRA, CARUNCLE/POLYP, EXCISION/LASER VAPORISATION",1C,Existing,urethra carunclepolyp excisionlaser vaporisation,-0.055311244566055094,-0.02818115047771077
56,SM703L,"LARYNX AND PHARYNX, VARIOUS LESIONS, LASER APPLICATION",3B,Existing,larynx pharynx various lesion laser application,0.2057007649706171,-0.014006919301129444
25,SM811E,"EAR, EXOSTOSIS OBTURANS, EXCISION BIOPSY",3A,Existing,ear exostosis obturans excision biopsy,-0.039180150710341345,0.43518921465099064
7,SM706E,"EAR, BILATERAL PREAURICULAR SINUS EXCISION",3A,Existing,ear bilateral preauricular sinus excision,-0.07464131569471295,0.20984162672591072
113,SK749N,"NERVE-FACIAL PARALYSIS, LOCAL MUSCLE TRANSFER",5A,Existing,nervefacial paralysis local muscle transfer,-0.0788433559098983,-0.01792301663020952
507,SB821T,"TENDON-FLEXOR (UPPER LIMB), INJURY, TENDON GRAFT",4C,Existing,tendonflexor upper limb injury tendon graft,-0.12424666588132997,0.002400416909678904
196,SD810V,"VEIN, VARIOUS LESIONS, BYPASS/GRAFT",5C,Existing,vein various lesion bypassgraft,0.49223435273759664,-0.0531324892495138
546,SB707W,"WRIST, DISTAL RADIUS FRACTURE, OPEN REDUCTION AND INTERNAL FIXATION (ORIF) (WITH ULNAR HEAD/STYLOID FIXATION/TFCC REPAIR)",4C,Existing,wrist distal radius fracture open reduction internal fixation orif ulnar headstyloid fixationtfcc repair,-0.15327988996241892,-0.20513576984917944
58,SH801T,"TESTIS, UNDESCENDED/ECTOPIC (BILATERAL), ORCHIDOPEXY/TRANSPLANTATION WITH HERNIA REPAIR",4A,Existing,testis undescendedectopic bilateral orchidopexytransplantation hernia repair,-0.09058029336527948,-0.07366483466873083
184,SF702L,"LIVER TRANSPLANT, RECIPIENT",7C,Existing,liver transplant recipient,-0.06924393362271326,-0.04493682463321354
314,SB800L,"LOWER LIMB, CRUSH INJURIES (EXTENSIVE), DEBRIDEMENT WITH REPAIR OF BONE AND SOFT TISSUES",6B,Existing,lower limb crush injury extensive debridement repair bone soft tissue,-0.15356339246369544,0.08255892329065252
82,SA718S,"SOFT TISSUE (LOWER LIMB), VARIOUS LESIONS, MAJOR RELEASE",4B,Existing,soft tissue lower limb various lesion major release,0.14181114972899775,0.15521519549719826
60,SL804E,"EYE, GLAUCOMA, GONIOTOMY/TRABECULOTOMY (UNILATERAL)",4A,Existing,eye glaucoma goniotomytrabeculotomy unilateral,-0.08125965003469064,-0.06982585078594379
88,SD800B,"BLOOD VESSELS, REACTIONARY/SECONDARY HEMORRHAGE AFTER MINOR OPERATION, HEMOSTASIS",MSP,Existing,blood vessel reactionarysecondary hemorrhage minor operation hemostasis,-0.06870270492159523,-0.057573835339984406
139,SL705O,"ORBIT, VARIOUS LESIONS, EXTENDED LATERAL ORBITOTOMY",6A,Existing,orbit various lesion extended lateral orbitotomy,0.30003946466602993,-0.019423343257418763
47,SH836P,"PROSTATE GLAND, VARIOUS LESIONS, TRANSURETHRAL RESECTION (TURP)/ENUCLEATION OF PROSTATE (RESECTED WEIGHT LESS THAN 30G)",4B,Descriptor change,prostate gland various lesion transurethral resection turpenucleation prostate resected weight le 30g,0.1315146709971393,-0.012712861101300326
151,SA856S,"SKIN, ANGIOMA, CAUTERISATION/INJECTION",1A,Existing,skin angioma cauterisationinjection,-0.10355837661545123,0.34507411005053923
19,SC703L,"LUNG, TUMOUR, IMAGING GUIDED PERCUTANEOUS LOCAL ABLATION, SIMPLE (RADIOFREQUENCY, CRYOTHERAPY, MICROWAVE, LASER, ALCOHOL, ETC)",3C,Existing,lung tumour imaging guided percutaneous local ablation simple radiofrequency cryotherapy microwave laser alcohol etc,-0.0664447318486974,-0.04935475466210063
130,SB811F,"FEMUR, FRACTURE, OPEN REDUCTION AND INTERNAL FIXATION WITH PLATE AND SCREWS",5A,Existing,femur fracture open reduction internal fixation plate screw,-0.14595610375451776,-0.1911490003857173
7,SA707B,"BREAST, TUMOR (MALIGNANT), WIDE EXCISION/ LUMPECTOMY/SEGMENTAL MASTECTOMY/ PARTIAL MASTECTOMY, WITH SENTINEL NODE BIOPSY/ AXILIARY NODE SAMPLING",4A,Existing,breast tumor malignant wide excision lumpectomysegmental mastectomy partial mastectomy sentinel node biopsy axiliary node sampling,-0.058455570782883715,0.22131165299914907
117,SD739H,"HEART, ELECTROPHYSIOLOGY STUDY WITHOUT ABLATION",3B,Existing,heart electrophysiology study without ablation,-0.08043334885307449,-0.10112508886618267
333,SF704T,"TEETH (2 TO 3), UNERUPTED/PARTIALLY ERUPTED/IMPACTED, SURGICAL EXPOSURE AND BONDING FOR TRACTION AND ASSISTED ERUPTION",3C,Existing,teeth 2 3 uneruptedpartially eruptedimpacted surgical exposure bonding traction assisted eruption,-0.07898254905786144,-0.031135623427755357
14,SJ803T,"THYROID, VARIOUS LESIONS, TOTAL/SUBTOTAL THYROIDECTOMY",5C,Existing,thyroid various lesion totalsubtotal thyroidectomy,0.392690294347633,-0.009127961413689982
83,SD707B,"BLOOD VESSELS, SUBCUTANEOUS IMPLANTED VASCULAR PORT, REMOVAL",1B,Existing,blood vessel subcutaneous implanted vascular port removal,-0.09430466609264677,0.03827865399180987
269,SB816J,"JOINTS (LOWER LIMB), VARIOUS LESIONS, EPIPHYSIOLYSIS WITH/WITHOUT MICROSURGERY",5C,Existing,joint lower limb various lesion epiphysiolysis withwithout microsurgery,0.2917641260637107,-0.007037917163064033
182,SA887S,"SKIN, WRINKLES, TOTAL RHYTIDECTOMY5",6B,"Descriptor
change",skin wrinkle total rhytidectomy5,-0.07070629379101255,0.20195204562547023
165,SA870S,"SKIN, SCAR, REVISION WITH Z-PLASTY",2C,Existing,skin scar revision zplasty,-0.08191372054421757,0.135214287929723
252,SB718J,"JOINTS, MAJOR INTRA-ARTICULAR FRACTURE WITH DISCONTINUITY OR BONE LOSS, RECONSTRUCTION (FOR UPPER LIMB)",5A,Existing,joint major intraarticular fracture discontinuity bone loss reconstruction upper limb,-0.11869206162144098,-0.04561276878885469
