S/N,Code,Description,Table,Classification,Cleaned_Description,PCA_X,PCA_Y
35,SB806B,"BONE (LOWER LIMB), OSTEOMYELITIS, DRAINAGE WITH CURETTAGE AND IRRIGATION",4A,Existing,bone lower limb osteomyelitis drainage curettage irrigation,-0.10850807374683756,-0.009523771461489632
533,SB805U,"UPPER LIMB, VARIOUS LESIONS, AMPUTATION",5C,Existing,upper limb various lesion amputation,0.27752203179577717,0.012465069148448481
142,SM700T,"THROAT, HYOID SUSPENSION",3B,Existing,throat hyoid suspension,-0.06883445033030501,-0.03281042080493673
109,SF706C,"COLON, COLONOSCOPY (SCREENING), FIBREOPTIC WITH REMOVAL OF POLYP (SINGLE OR MULTIPLE LESS THAN 1CM)",3A,Existing,colon colonoscopy screening fibreoptic removal polyp single multiple le 1cm,-0.08970739528541828,-0.031725121915092705
79,SF705B,"BILE DUCTS, VARIOUS LESIONS, PERCUTANEOUS TRANSHEPATIC CHOLANGIOGRAPHY (PTC)",2C,Existing,bile duct various lesion percutaneous transhepatic cholangiography ptc,0.3095089559181565,-0.052665492753834676
173,SK760S,"SPINE, LUMBAR/SACRAL/CAUDAL, INJECTION, EPIDURAL, WITHOUT OTHER PROCEDURES",1A,Existing,spine lumbarsacralcaudal injection epidural without procedure,-0.06946392198377258,-0.11167758033969939
114,SK758N,"NERVE, FAECAL INCONTINENCE OR OTHER, PERCUTANEOUS TIBIAL NERVE STIMULATION",1A,Existing,nerve faecal incontinence percutaneous tibial nerve stimulation,-0.08585883028982538,-0.08904694039946794
96,SL845E,"EYELIDS, TUMOR, INCISIONAL BIOPSY",MSP,Existing,eyelid tumor incisional biopsy,-0.053707381144710575,0.22189001179375697
108,SD743H,"HEART, CORONARY ANGIOGRAPHY AND INTRACORONARY PHYSIOLOGICAL ASSESSMENT (INCLUSIVE OF PRESSURE WIRE) AND/OR IMAGING/VISUALIZATION (INCLUSIVE OF IV U/S AND OCT), WITHOUT PCI",3C,New,heart coronary angiography intracoronary physiological assessment inclusive pressure wire andor imagingvisualization inclusive iv u oct without pci,-0.07613474175967865,-0.09177585968189457
132,SF804D,"DUODENUM, ULCER, PARTIAL GASTRECTOMY",5C,Existing,duodenum ulcer partial gastrectomy,-0.06547743107068192,-0.031533151875713865
33,SE817L,"LYMPHATICS, LYMPHEDEMA, EXCISION (LARGE & DEEP SEATED)",5C,Existing,lymphatics lymphedema excision large deep seated,-0.097895786855601,0.20580755302532372
79,SI716U,"UTERUS, LYSIS OF ASHERMAN'S (COMPLICATED), HYSTEROSCOPIC",3A,Existing,uterus lysis ashermans complicated hysteroscopic,-0.0998114777072239,-0.06118982283201602
109,SA813S,"SKIN AND SUBCUTANEOUS TISSUE, DEFECT (DEEP), DIRECT FLAP (CROSS ARM/RADIAL FORE ARM/ABDOMINAL/SIMILAR)",5A,Existing,skin subcutaneous tissue defect deep direct flap cross armradial fore armabdominalsimilar,-0.1365247082364952,0.3165510977491997
30,SE814L,"LYMPHATICS, LYMPHANGIECTASIS, LIMITED EXCISION",2C,Existing,lymphatics lymphangiectasis limited excision,-0.08727772715777907,0.23850099291044158
369,SB827M,"MAXILLA, DEFORMITY - LEFORT I, OSTEOTOMY",5C,Existing,maxilla deformity lefort osteotomy,-0.08633141190235816,-0.07122745371889644
90,SF717B,"BOWELS, ENDOSCOPIC ULTRASOUND WITH FINE NEEDLE ASPIRATION",3A,Existing,bowel endoscopic ultrasound fine needle aspiration,-0.07179546852689396,-0.04980173772633899
97,SF803B,"BILE DUCT, VARIOUS LESIONS, CHOLEDOCHOTOMY (EXPLORATION COMMON BILE DUCT ONLY)",4C,Existing,bile duct various lesion choledochotomy exploration common bile duct,0.16237096542396884,-0.03934912249151407
24,SH812P,"PENIS, PRIAPISM, DECOMPRESSION (SINGLE)",1B,Existing,penis priapism decompression single,-0.07447999727298371,-0.05362761367150613
73,SG801K,"KIDNEY, BLOCKED NEPHROSTOMY TUBE, CHANGE",1A,Existing,kidney blocked nephrostomy tube change,-0.06401299132840886,-0.06159096554573234
58,SG716K,"KIDNEY, VARIOUS LESIONS, CHECK NEPHROSTOGRAM",1A,Existing,kidney various lesion check nephrostogram,0.4847957433905864,-0.03403540873355735
64,SD822A,"ARTERY, VARIOUS LESIONS, AXILLARY- FEMORAL/SUBCLAVIAN-FEMORAL BY-PASS",5C,Existing,artery various lesion axillary femoralsubclavianfemoral bypass,0.2667503331155773,-0.040723826696049056
121,SD801H,"HEART, AORTIC/MITRAL VALVE LESIONS, BALLOON VALVULOPLASTY",5A,Existing,heart aorticmitral valve lesion balloon valvuloplasty,0.07821855726118891,-0.07558356522052839
16,SE715L,"LYMPH NODE (CERVICAL), RADICAL WITH FLAP RECONSTRUCTION",6B,Existing,lymph node cervical radical flap reconstruction,-0.04463005564144887,0.03703775467031437
7,SK706A,"ARTERY, EXTRACRANIAL, VARIOUS LESIONS, STENTING",4B,Existing,artery extracranial various lesion stenting,0.2447051072131614,-0.04318560675231383
36,SK800B,"BRAIN AND SPINE, ARACHNOIDAL CYST, OPERATION",6B,Existing,brain spine arachnoidal cyst operation,-0.08103089223065058,-0.0653442696186499
142,SK717S,"SACRO-ILIAC JOINT, SACROILIAC JOINT BLOCK (INJECTION OF ANAESTHETIC, THERAPEUTIC SUBSTANCE), UNILATERAL",1B,Existing,sacroiliac joint sacroiliac joint block injection anaesthetic therapeutic substance unilateral,-0.06652534644932964,-0.09276174845705913
58,SD816A,"ARTERY, ARTERIO-VENOUS FISTULA (SMALL), EXCISION",4A,Existing,artery arteriovenous fistula small excision,-0.07891950589923935,0.1655403424915348
144,SA848S,"SKIN AND SUBCUTANEOUS TISSUE, NEUROFIBROMATOSIS OF FACE AND NECK, EXCISION (SMALL<3CM)",2A,Existing,skin subcutaneous tissue neurofibromatosis face neck excision small3cm,-0.1383740198302642,0.5608771916171054
106,SM723N,"NOSE, VARIOUS LESIONS, RHINOPLASTY (TOTAL) INCLUDING CORRECTION OF ALL BONY AND CARTILAGINOUS ELEMENTS",5C,Existing,nose various lesion rhinoplasty total including correction bony cartilaginous element,0.19703462135408284,-0.03047528348400332
33,SL702E,"EYE, GLAUCOMA, GONIOTOMY/TRABECULOTOMY (BILATERAL) - PAEDIATRIC",5A,Existing,eye glaucoma goniotomytrabeculotomy bilateral paediatric,-0.08294716336012799,-0.06885349411621543
24,SD723A,"ARTERY, TUMOUR, TRANS-ARTERIAL CHEMO- EMBOLIZATION (TACE)",4A,Existing,artery tumour transarterial chemo embolization tace,-0.06184095685385619,-0.0489400340313626
23,SH811P,"PENIS, PRIAPISM, DECOMPRESSION (SHUNT OP)",3C,Existing,penis priapism decompression shunt op,-0.06421880744506306,-0.05512073484989484
330,SF701T,"TOOTH, UNERUPTED/PARTIALLY ERUPTED/IMPACTED, SURGICAL EXPOSURE",1C,Existing,tooth uneruptedpartially eruptedimpacted surgical exposure,-0.07985011103197576,-0.027974618310543854
535,SB807U,"UPPER LIMB, VARIOUS LESIONS, VASCULARISED FREE MUSCLE TRANSFER",7A,Existing,upper limb various lesion vascularised free muscle transfer,0.13387936718419666,0.013308541530640261
518,SB832T,"TENDON, EXTENSOR (UPPER LIMB), DEFECT, GRAFTING (MULTIPLE)",5A,Existing,tendon extensor upper limb defect grafting multiple,-0.13533740641755213,0.026721488984816882
30,SM816E,"EAR, LACERATION (FULL THICKNESS), REPAIR > 3CM",3A,Existing,ear laceration full thickness repair 3cm,-0.10589604694308363,-0.003944738565728562
255,SB801J,"JOINTS (FINGER), VARIOUS LESIONS, ARTHRODESIS",3C,Existing,joint finger various lesion arthrodesis,0.28903414100202524,-0.060968121682163444
65,SB702C,"CLAVICLE, CLAVICLE FRACTURE, DELAYED UNION/REVISION AND ORIF WITH/WITHOUT BONE GRAFTING",4B,Existing,clavicle clavicle fracture delayed unionrevision orif withwithout bone grafting,-0.10002806078970046,-0.06159060713137742
76,SA712S,"SOFT TISSUE (LOWER LIMB), CONTRACTURE, MINOR RELEASE",2C,Existing,soft tissue lower limb contracture minor release,-0.12878664330121725,0.1289122878210814
179,SF803I,"INTESTINE, INTUSSUSCEPTION, RESECTION",4A,Existing,intestine intussusception resection,-0.05832578902444218,-0.04054752095669072
245,SB711J,"JOINTS (TEMPORO-MANDIBULAR), VARIOUS LESIONS, CONDYLOTOMY",4A,Existing,joint temporomandibular various lesion condylotomy,0.37579844307762494,-0.06091346515846895
196,SB807H,"HAND, DEFORMITIES, MAJOR RECONSTRUCTIVE PROCEDURES",5C,Existing,hand deformity major reconstructive procedure,-0.10551381983120171,-0.04255075468008409
127,SK812N,"NERVE, ULNAR, ENTRAPMENT, TRANSPOSITION",5A,Existing,nerve ulnar entrapment transposition,-0.08624104753542396,-0.05877255920869814
177,SA882S,"SKIN, VARIOUS LESIONS, TRIAL DERMABRASION",1A,Existing,skin various lesion trial dermabrasion,0.5237690442353391,0.27791763302445355
10,SE709L,"LYMPHATICS (UPPER LIMB), LYMPHANGIOMA, EXCISION",6B,Existing,lymphatics upper limb lymphangioma excision,-0.12991583743072097,0.27018947565596796
170,SL700V,"VITREOUS, INTRAVITREAL INJECTIONS",1B,Uptable,vitreous intravitreal injection,-0.06795363449206321,-0.05336488243800258
75,SK707N,"NERVE (OROFACIAL), DEFECT, GRAFT (MULTIPLE) USING MICROSURGICAL TECHNIQUES (INCLUDE HARVESTING)",6A,Existing,nerve orofacial defect graft multiple using microsurgical technique include harvesting,-0.09807981201128661,-0.02450292377015238
288,SF700R,"RECTUM, PERINEAL RECTOSIGMOIDECTOMY FOR RECTAL PROLAPSE",5C,Existing,rectum perineal rectosigmoidectomy rectal prolapse,-0.07713557856129641,-0.04198944357614973
47,SK811B,"BRAIN, INTRACRANIAL ABSCESS, CRANIECTOMY AND DRAINAGE",6A,Existing,brain intracranial abscess craniectomy drainage,-0.09726023283253835,-0.05575316860807804
396,SB800N,"DIGIT(S), NAIL BED, DEFORMITY/DEFECT, RECONSTRUCTION",4B,Existing,digit nail bed deformitydefect reconstruction,-0.08369390872287878,-0.03460945792496663
62,SA703R,"RADIOTHERAPY, INTRACAVITARY BRACHYTHERAPY (MULTI-CHANNEL): CERVIX, OTHERS",2C,Existing,radiotherapy intracavitary brachytherapy multichannel cervix others,-0.06927320009033577,-0.03741932239741299
219,SF708M,"MOUTH, PERIODONTIUM (WITHIN 2 QUADRANTS), SOFT TISSUE DEFECT/DEFORMITY, GINGIVOPLASTY WITH AUTOGENOUS SOFT TISSUE GRAFT",3A,Descriptor change,mouth periodontium within 2 quadrant soft tissue defectdeformity gingivoplasty autogenous soft tissue graft,-0.1098486756316755,0.16215743146222059
184,SI833V,"VULVA, SEBACEOUS CYST/EPITHELIALCYST ETC, EXICISION",MSP,Existing,vulva sebaceous cystepithelialcyst etc exicision,-0.08117455745253187,-0.027363143071944276
46,SD804A,"AORTA, VARIOUS LESIONS, INSERTION/REMOVAL OF INTRA AORTIC BALLOON",3A,Existing,aorta various lesion insertionremoval intra aortic balloon,0.2144722097581604,-0.0261386149080737
109,SM726N,"NOSE, NASOENDOSCOPY/NASOPHARYNGOLARYNGOSCOPY (REPEAT EXAMINATIONS, DURING A 90-DAY PERIOD)18",MSP,New,nose nasoendoscopynasopharyngolaryngoscopy repeat examination 90day period18,-0.05098367557323672,-0.02712125884538451
17,SB702B,"BONE (SKULL), TUMOR (LARGE>3CM), EXCISION AND EXTENSIVE RECONSTRUCTION (DURA, SKULL, SKIN)",7B,Existing,bone skull tumor large3cm excision extensive reconstruction dura skull skin,-0.12684567834170749,0.2735288807281994
79,SB702E,"ELBOW, CORONOID FRACTURE, ORIF",4B,Existing,elbow coronoid fracture orif,-0.11378237828009213,-0.12431111224839457
114,SG815U,"URETHRA, FISTULA, CLOSURE",2C,Existing,urethra fistula closure,-0.06938027650391358,-0.03948099006401369
81,SI718U,"UTERUS/VAGINA, MIS ASSISTED VAGINAL HYSTERECTOMY (LAVH) WITH/WITHOUT PELVIC FLOOR REPAIR (PFR)",4B,Existing,uterusvagina mi assisted vaginal hysterectomy lavh withwithout pelvic floor repair pfr,-0.09651442521593885,-0.05320697224863448
315,SF713S,"STOMACH, OBESITY, BILIOPANCREATIC DIVERSION WITH/WITHOUT DUODENAL SWITCH",5C,Existing,stomach obesity biliopancreatic diversion withwithout duodenal switch,-0.06536931613151119,-0.017098941347819516
166,SI815V,"VAGINA, RECTOCOELE, POSTERIOR REPAIR",2C,Existing,vagina rectocoele posterior repair,-0.10886298461128052,-0.07871071015583621
37,SA823B,"BREAST, TUMOR (MALIGNANT), WIDE EXCISION/ LUMPECTOMY/SEGMENTAL MASTECTOMY/ PARTIAL MASTECTOMY, WITH AXILIARY CLEARANCE, WITH/WITHOUT SENTINEL NODE BIOPSY",4C,Existing,breast tumor malignant wide excision lumpectomysegmental mastectomy partial mastectomy axiliary clearance withwithout sentinel node biopsy,-0.06210228146237438,0.23238905572803492
164,SL802R,"RETINA, DETACHMENT (COMPLEX), OPERATION (MORE THAN ONE PLOMB/ENCIRCLAGE)",6B,Descriptor Change,retina detachment complex operation one plombencirclage,-0.0807477286080862,-0.0526393156392549
136,SF703E,"ESOPHAGUS, MOTILITY DISORDER, LONG MYOTOMY",4B,Descriptor change,esophagus motility disorder long myotomy,-0.07766954803848586,-0.03299376582228789
463,SB801S,"SHOULDER, ACROMIOCLAVICULAR JOINT STABILISATION/RECONSTRUCTION",5B,Existing,shoulder acromioclavicular joint stabilisationreconstruction,-0.040408592217210285,-0.07451868009136739
94,SK727N,"NERVE (UPPER LIMB)-MAJOR, INJURY, MICROSURGICAL REPAIR (SINGLE)",4B,Existing,nerve upper limbmajor injury microsurgical repair single,-0.13785066948479943,-0.07356060690639168
38,SM824E,"EAR, SEBACEOUS CYST, EXCISION",1B,Existing,ear sebaceous cyst excision,-0.09687931071495641,0.2542570795692246
140,SK715S,"SACRO-ILIAC JOINT, RADIOFREQUENCY, BILATERAL",4A,Existing,sacroiliac joint radiofrequency bilateral,-0.053283561128023675,-0.07862270390526696
151,SD834H,"HEART/LUNG, VARIOUS LESIONS, HEART AND LUNG TRANSPLANTATION",7C,Existing,heartlung various lesion heart lung transplantation,0.2345813495738793,-0.06619369566303593
7,SH702P,"PENIS, PEYRONIE'S DISEASE, INCISION AND GRAFTING",3C,Existing,penis peyronies disease incision grafting,-0.08611520724863765,-0.040072385813852564
45,SF822A,"ABDOMINAL WALL, STRANGULATED/OBSTRUCTED HERNIA, REPAIR WITHOUT BOWEL RESECTION",3C,Existing,abdominal wall strangulatedobstructed hernia repair without bowel resection,-0.09317817132425334,-0.08520871903487912
75,SI712U,"UTERUS, SUBTOTAL/TOTAL HYSTERECTOMY, >12WKS",5A,Descriptor change,uterus subtotaltotal hysterectomy 12wks,-0.1025605127183407,-0.07327270185636595
539,SB700W,"WRIST, THERAPEUTIC ARTHROSCOPY",4A,Existing,wrist therapeutic arthroscopy,-0.0685382998613301,-0.05474592282474876
192,SA898S,"SWEAT GLAND, AXILLARY HYPERHIDROSIS, WEDGE EXCISION (UNILATERAL)",2C,Existing,sweat gland axillary hyperhidrosis wedge excision unilateral,-0.06760966045587824,0.155534710215918
93,SD709H,"HEART, CAROTID ANGIOPLASTY AND STENTING (WITH EMBOLIC PROTECTION)",5A,Existing,heart carotid angioplasty stenting embolic protection,-0.07713080919614984,-0.07351453052232436
257,SB803J,"JOINTS (FINGER), VARIOUS LESIONS, REPLACEMENT ARTHROPLASTY",4C,Existing,joint finger various lesion replacement arthroplasty,0.2683315112761382,-0.07016691109268464
340,SF801T,"TEETH (2 TO 3), IMPACTED, EXCISION WITH REMOVAL OF BONE (WITHOUT TOOTH DIVISION)",3B,Existing,teeth 2 3 impacted excision removal bone without tooth division,-0.09892748895635754,0.11381547741102949
476,SB701T,"TIBIA, FRACTURE, OPEN REDUCTION AND INTERNAL FIXATION WITH PLATES AND SCREWS, COMMINUTED",5C,Existing,tibia fracture open reduction internal fixation plate screw comminuted,-0.1443803274381656,-0.1879651568178597
5,SC704B,"BRONCHUS/LUNG, BRONCHOSCOPY WITH BIOPSY, BRONCHOALVEOLAR LAVAGE",2A,Existing,bronchuslung bronchoscopy biopsy bronchoalveolar lavage,-0.03450518148684135,0.0747186350977323
39,SM825E,"EAR, TOTAL AMPUTATION, MICROVASCULAR RECONSTRUCTION",7C,Existing,ear total amputation microvascular reconstruction,-0.0509982660636719,-0.03593896721452499
95,SL844E,"EYELIDS, TUMOR, EXCISION AND REPAIR WITH LOCAL FLAP",4A,Existing,eyelid tumor excision repair local flap,-0.13941936111124845,0.25954544066278934
529,SB801U,"UPPER LIMB, DEFORMITY, BONY AND SOFT TISSUE RECONSTRUCTION",5C,Existing,upper limb deformity bony soft tissue reconstruction,-0.14848532285104604,0.13328404180094333
110,SL701L,"LENS, CATARACT (PAEDIATRIC), EXTRACTION WITH ANTERIOR VITRECTOMY",4B,Existing,lens cataract paediatric extraction anterior vitrectomy,-0.07211934933979045,-0.062228825069156536
322,SF807S,"STOMACH, TUMOR OF CARDIA, ENDOSCOPIC YAG LASER SURGERY/VAPORISATION",3B,Existing,stomach tumor cardia endoscopic yag laser surgeryvaporisation,-0.10234226049103104,0.04815093234016443
213,SB824H,"HEAD-FACE, TRAUMA, CRANIOFACIAL APPROACH REDUCTION AND FIXATION WITH BONE GRAFT",6C,Existing,headface trauma craniofacial approach reduction fixation bone graft,-0.11762188156782934,-0.08765331259312223
21,SF722A,"ANUS, SPHINCTEROPLASTY FOR ANAL INCONTINENCE",4B,Existing,anus sphincteroplasty anal incontinence,-0.08423650869011995,-0.04529958791697447
82,SG810K,"KIDNEY, PYONEPHROSIS, DRAINAGE (OPEN)",3B,Existing,kidney pyonephrosis drainage open,-0.08342474241774793,-0.11465768170946782
12,SI803C,"CERVIX, CERVICAL INTRAEPITHELIAL NEOPLASIA, CONE BIOPSY WITH/WITHOUT LASER",3A,Existing,cervix cervical intraepithelial neoplasia cone biopsy withwithout laser,-0.012821808700069846,0.08271561265598407
90,SG701U,"URETER, EXTRA CORPOREAL SHOCKWAVE LITHOTRIPSY (ESWL) FOR URETERIC STONE",4A,Existing,ureter extra corporeal shockwave lithotripsy eswl ureteric stone,-0.04785483728372931,-0.04971294744201779
70,SC819T,"TRACHEA, VARIOUS LESIONS, TRACHEA AND BRONCHUS RECONSTRUCTION WITH CARDIOPULMONARY BYPASS",7B,New,trachea various lesion trachea bronchus reconstruction cardiopulmonary bypass,0.15522883350715744,-0.04197606354476381
10,SL701C,"CONJUNCTIVA, PTERYGIUM, REMOVAL, COMPLEX (RECURRENT, DOUBLE, SYMBLEPHARON), WITH OR WITHOUT AMNIOTIC MEMBRANE TRANSPLANT",3B,Existing,conjunctiva pterygium removal complex recurrent double symblepharon without amniotic membrane transplant,-0.09079209533656828,-0.05153131227209212
417,SB704S,"SACRUM, FRACTURE, OPEN REDUCTION AND INTERNAL FIXATION",5C,Existing,sacrum fracture open reduction internal fixation,-0.16628549403473408,-0.23806237399963845
115,SA819S,"SKIN AND SUBCUTANEOUS TISSUE, DEFECT (MULTIPLE DIGITS), STAGED LOCAL FLAP (DIVISION)",2A,Existing,skin subcutaneous tissue defect multiple digit staged local flap division,-0.14186313971819767,0.27260730179145926
218,SB829H,"HIP, CONGENITAL DISLOCATION, OPEN REDUCTION INCLUDING RECONSTRUCTION",6B,Existing,hip congenital dislocation open reduction including reconstruction,-0.10065603574802774,-0.1263658283500903
99,SM716N,"NOSE, VARIOUS LESIONS, COMPOSITE GRAFT (CHONDRO-CUTANEOUS/CHONDRO-MUCOSAL)",4A,Existing,nose various lesion composite graft chondrocutaneouschondromucosal,0.35813264878181467,0.01585753603489743
61,SH804T,"SCROTUM, EXPLORATION, DETORSION OF TESTIS AND BILATERAL TESTES FIXATION",2A,Existing,scrotum exploration detorsion testis bilateral testis fixation,-0.06070102409363411,-0.07230027138059089
143,SD824H,"HEART, VARIOUS LESIONS, OPEN HEART SURGERY (ONE PROCEDURE)",6C,Existing,heart various lesion open heart surgery one procedure,0.13390650091861755,-0.12882634957232988
405,SB705P,"PELVIS, FRACTURE, COMBINED ANTERIOR AND POSTERIOR FIXATION OR BILATERAL FIXATION",6B,New,pelvis fracture combined anterior posterior fixation bilateral fixation,-0.12220152303360586,-0.15100937572118694
104,SM721N,"NOSE, VARIOUS LESIONS, RHINOPLASTY (RESTORATION OF THE FACE INVOLVING AUTOGENOUS BONE OR COSTAL CARTILAGE GRAFT)",5A,Existing,nose various lesion rhinoplasty restoration face involving autogenous bone costal cartilage graft,0.136622405305775,0.026462643965712473
90,SA726S,"SKIN CANCER, MOHS MICROGRAPHIC SURGERY WITH RECONSTRUCTION/GRAFT/FLAP (</= 5 TISSUE BLOCKS)",2C,Existing,skin cancer mohs micrographic surgery reconstructiongraftflap 5 tissue block,-0.13188167046208352,0.2404642797340756
22,SD721A,"ARTERY, STENOSIS/OCCLUSION, PERCUTANEOUS TRANSLUMINAL ANGIOPLASTY (PTA), SIMPLE",3A,Existing,artery stenosisocclusion percutaneous transluminal angioplasty pta simple,-0.05139741910744358,-0.07770714727068367
527,SB704U,"UPPER LIMB/LOWER LIMB, UPPER LIMB FRACTURES, MINIMALLY INVASIVE FIXATION",4B,Existing,upper limblower limb upper limb fracture minimally invasive fixation,-0.1556478967486209,-0.05356007817578632
103,SM720N,"NOSE, RHINOPLASTY, CORRECTION OF LATERAL/ALAR CARTILAGE AND/OR SEPTAL STRUT (INCLUDING ALL GRAFTS, EXTRACORPOREAL SEPTOPLASTY), RECONSTRUCTION OF NASAL VALVE(S), AND/OR EXTRANASAL CARTILAGE HARVEST",4C,Existing,nose rhinoplasty correction lateralalar cartilage andor septal strut including graft extracorporeal septoplasty reconstruction nasal valve andor extranasal cartilage harvest,-0.06568227234304727,-0.035816834359481096
554,SB715W,"WRIST, VARIOUS LESIONS, REVISION TOTAL JOINT ARTHROPLASTY",6C,Descriptor change,wrist various lesion revision total joint arthroplasty,0.24013626643378336,-0.06258595101814957
299,SB714K,"KNEE, MENISCUS/CARTILAGE, MIS CARTILAGE HARVESTING",4A,Existing,knee meniscuscartilage mi cartilage harvesting,-0.06904110878395482,-0.05242961817657292
199,SF804L,"LIVER, ABSCESS, TRANS-ABDOMINAL DRAINAGE",3C,Descriptor change,liver abscess transabdominal drainage,-0.08806416043878702,-0.06130264331116436
248,SF820M,"MOUTH, ORO-ANTRAL FISTULA, REMOVAL OF TOOTH/ROOTS IN ANTRUM AND CLOSURE",3B,Existing,mouth oroantral fistula removal toothroots antrum closure,-0.09782656516947584,-0.016627624781936176
66,SH809T,"TESTIS, VARIOUS LESIONS, ORCHIDECTOMY WITH COMPLETE EXCISION OF SPERMATIC CORD",3A,Existing,testis various lesion orchidectomy complete excision spermatic cord,0.20761546526318642,0.15770305206049995
12,SA712B,"BREAST, VARIOUS LESIONS, WIRE LOCALISATION, EXCISION (SINGLE)",3A,Existing,breast various lesion wire localisation excision single,0.23042023229407207,0.19268037293839743
197,SB808H,"HAND, DEFORMITIES, OSTEOTOMY",3B,Existing,hand deformity osteotomy,-0.10683588036583995,-0.051304161020089736
85,SB708E,"ELBOW, VARIOUS LESIONS, PRIMARY TOTAL JOINT ARTHROPLASTY",6A,Descriptor change,elbow various lesion primary total joint arthroplasty,0.23120498612514406,-0.06462245225382175
95,SM712N,"NOSE, SIMPLE FRACTURE, MANIPULATION",1B,Existing,nose simple fracture manipulation,-0.09428246202137398,-0.08723929978148733
34,SE818L,"LYMPHATICS, LYMPHEDEMA, EXCISION (LARGE)",4A,Existing,lymphatics lymphedema excision large,-0.09352971015463715,0.2161025232951853
27,SK704B,"BRAIN, DEEP BRAIN STIMULATION, UNILATERAL",7A,Existing,brain deep brain stimulation unilateral,-0.0846682656536191,-0.02478877479517785
114,SF711C,"COLON, SIGMOID, SIGMOIDOSCOPY WITH POLYPECTOMY WITH BIOPSY",1C,Existing,colon sigmoid sigmoidoscopy polypectomy biopsy,-0.0004923703051399494,0.12048435672630298
6,SG705B,"BLADDER, VARIOUS LESIONS, CATHETERISATION",MSP,Existing,bladder various lesion catheterisation,0.28970136182008194,-0.021563075090741315
36,SH824P,"PENIS, VARIOUS LESIONS, INJECTION",MSP,Existing,penis various lesion injection,0.31515551522524077,-0.045231554444749786
20,SK801A,"ARTERY-CAROTID, ARTERIO-OCCLUSIVE LESIONS, EXTERNAL CAROTID INTERNAL CAROTID BYPASS, SIMPLE",6B,Existing,arterycarotid arterioocclusive lesion external carotid internal carotid bypass simple,0.00026550380627416494,-0.056503986749266474
172,SL800V,"VITREOUS, VARIOUS LESIONS, SIMPLE VITRECTOMY (PARS PLANA OR VITREOUS WASHOUT)",5C,Existing,vitreous various lesion simple vitrectomy par plana vitreous washout,0.1376294872629919,-0.0352474719193534
171,SL701V,"VITREOUS, VARIOUS LESIONS, COMPLEX POSTERIOR VITRECTOMY (PVR, GRT, TRAUMA)",6B,Existing,vitreous various lesion complex posterior vitrectomy pvr grt trauma,0.16285810206781573,-0.049900333017396055
16,SG715B,"BLADDER/URETHRA, TRANSURETHRAL RESECTION OF BLADDER TUMOUR (>3CM)",4B,Existing,bladderurethra transurethral resection bladder tumour 3cm,-0.0731654079656553,-0.007873170109602291
491,SB805T,"TENDON SHEATH (UPPER LIMB), DE QUERVAIN'S (UNILATERAL), RELEASE",3A,Existing,tendon sheath upper limb de quervains unilateral release,-0.11541848847294933,-0.003537873374759816
100,SL850E,"EYELIDS, VARIOUS LESIONS, COMPOSITE GRAFT (CHONDRO-CUTANEOUS/CHONDRO-MUCOSAL)",4A,Existing,eyelid various lesion composite graft chondrocutaneouschondromucosal,0.35938350620623916,0.019500771351155174
4,SH801M,"MALE GENITALIA, TRANSSEXUALISM (TRANSVESTISM), SEX REASSIGNMENT WITH MAMMOPLASTY (MALE TO FEMALE)",6B,Existing,male genitalia transsexualism transvestism sex reassignment mammoplasty male female,-0.076310675122271,-0.03165857429206816
79,SM802M,"MASTOID, VARIOUS LESIONS, MASTOIDECTOMY (RADICAL/MODIFIED)",4B,Existing,mastoid various lesion mastoidectomy radicalmodified,0.264058506566469,-0.023911148193329484
67,SM714L,"LARYNX, VARIOUS DISORDERS, LARYNGEAL FRAMEWORK SURGERY, THYROPLASTY TYPES I-IV INCLUDING OPEN MEDIALISATION",4B,Existing,larynx various disorder laryngeal framework surgery thyroplasty type iiv including open medialisation,0.06577497266228839,-0.07228207073130284
490,SB804T,"TENDON SHEATH (UPPER LIMB), DE QUERVAIN'S (BILATERAL), RELEASE",3C,Existing,tendon sheath upper limb de quervains bilateral release,-0.11667560182863769,-0.005045965992591521
177,SK764S,"SPHENOPALATINE GANGLION, BLOCK, ANAESTHETIC",3B,Existing,sphenopalatine ganglion block anaesthetic,-0.10102762917842724,-0.07469371653405231
50,SI801O,"OVARY, TUMOR/CYST, ASPIRATION EXCEPT FOR OVUM RETRIEVAL",3B,Existing,ovary tumorcyst aspiration except ovum retrieval,-0.06435667456177015,-0.03833049264868699
25,SD724A,"ARTERY, TUMOUR, TRANS-ARTERIAL RADIO NUCLIDE INFUSION",4B,Existing,artery tumour transarterial radio nuclide infusion,-0.056767207032862865,-0.04820487875351257
64,SG722K,"KIDNEY, VARIOUS LESIONS, SIMPLE NEPHRECTOMY, LAPROSCOPIC",4C,Existing,kidney various lesion simple nephrectomy laproscopic,0.2652637577553367,-0.04308305273167676
160,SA865S,"SKIN, KERATOSES/WARTS/TAGS/SIMILAR LESIONS, EXCISION (NOT MORE THAN 5 LESIONS)3",1A,Descriptor change,skin keratoseswartstagssimilar lesion excision 5 lesions3,0.16863506647249674,0.615287939828063
69,SD827A,"ARTERY, VARIOUS LESIONS, TRANSLUMINAL ARTERIOPLASTY",3A,Existing,artery various lesion transluminal arterioplasty,0.31885283501856243,-0.04302667189262337
297,SB712K,"KNEE, MENISCUS/CARTILAGE ( SMALL DEFECTS ), MOSAICPLASTY OR OATS",5C,"Descriptor
change",knee meniscuscartilage small defect mosaicplasty oat,-0.08310619738373394,0.013255948732073372
58,SB830B,"BONE (UPPER/LOWER LIMB), VARIOUS LESIONS, BONE LOSS, BONE TRANSFER",6A,Existing,bone upperlower limb various lesion bone loss bone transfer,0.08485246947344552,0.018996696334731798
145,SI715V,"VULVA, LABIAL ABNORMALITY, HYMENOPLASTY",1B,Existing,vulva labial abnormality hymenoplasty,-0.0846846828053561,-0.020603083843716202
136,SB818F,"FINGER, SWAN NECK/BOUTONNIERE DEFORMITY (SINGLE), CORRECTION",4A,Existing,finger swan neckboutonniere deformity single correction,-0.09391931446096084,-0.06253045677773776
